{
  "schemaVersion": "1.0.0",
  "componentSystemId": "mz.systems.components.product-commerce",
  "version": "0.1.0",
  "status": "active-review-candidate",
  "productionAuthority": false,
  "gateId": "H-EXP-04B-CARD-FUNCTIONAL-PROOF",
  "candidateRevision": "product-card-02-phase-b-pb2-r04",
  "taskId": "TASK-EXP-04-PRODUCT-CARD",
  "title": "Product Card 02 · Phase B Functional Website Components",
  "thesis": "Phase B applies the approved Round 10 visual grammar to real product-marketing and commerce interfaces. The exact Round 03 receipt records eleven keeps, thirty-five revisions and one kill across forty-seven functional candidates. PB2 Round 04 carries those eleven champions forward, rebuilds the thirty-five named revisions, removes B-FT06 alongside the previously killed B-FT04, and presents forty-six functional candidates across six families. The thirty-two canonical Phase A keeps remain approved visual inputs and lineage references, not separate Round 04 candidates. Every surviving functional candidate retains every Phase A reference recorded in the receipts, while production authority remains false and the final human gate remains pending.",
  "inherits": {
    "phaseAContract": {
      "path": "brand-kit/expressions/product-card/product-card.source.json",
      "sha256": "fa2e27bb4bffae992e4d8cde807a5c29c62d973cc1b652a22af7227fca0c39ba"
    },
    "phaseASchema": {
      "path": "brand-kit/expressions/product-card/product-card.schema.json",
      "sha256": "6c14a65b58979578d3c1ef15c2147a9443829bc84d10448e95660f619cf54a4b"
    },
    "phaseAApproval": {
      "path": "brand-kit/expressions/product-card/review.json",
      "sha256": "54b52c31e505c28bfd796e98306f32eae72fad97ac9a12f551f72aed8a34153b"
    },
    "round10Receipt": {
      "path": "brand-kit/expressions/product-card/round-10-feedback.json",
      "sha256": "f1ed134bb0562a9bc258430cfe16f469ea5b3d64c1f55d35f64dfc275cd2f966"
    },
    "designEthos": {
      "path": "brand-kit/docs/PRODUCT-CARD-DESIGN-ETHOS.md",
      "sha256": "d936b4373716f73f1ea63108c00f58a31ecba42bdc4aa0393c3e95457a89be86"
    }
  },
  "evidence": {
    "round01Feedback": {
      "path": "brand-kit/expressions/product-card/phase-b/round-01-feedback.json",
      "sha256": "858dca76ab4e3fcaabcc5a4ca3996f7ce3a4a2654681e9085220bd6d784be9b1"
    },
    "round02Feedback": {
      "path": "brand-kit/expressions/product-card/phase-b/round-02-feedback.json",
      "sha256": "86f8e5fd02514ec2a55d81eecfb08e91946f66ddcaa667a379b87c5d584b182f"
    },
    "round03Feedback": {
      "path": "brand-kit/expressions/product-card/phase-b/round-03-feedback.json",
      "sha256": "0ebc1bc12d4a41d0ec66aed163f130aa625db9615e09e24479f52fed1c7d566c"
    }
  },
  "specimenContract": {
    "totalCount": 46,
    "phaseAVisualInputs": {
      "count": 32,
      "role": "approved-visual-inputs",
      "round04CandidateCount": 0,
      "sourceReceipt": "brand-kit/expressions/product-card/round-10-feedback.json",
      "sourceIds": ["QC01", "QC02", "QC03", "QC04", "ES02", "ES04", "IC01", "IC02", "IC03", "HL01", "HL02", "HL04", "QF01", "QF03", "FC01", "FC02", "PO01", "PO02", "ST01", "ST02", "SG01", "FN01", "BX01", "BX02", "SH01", "SH02", "SH03", "FS01", "FS02", "EX02", "BO01", "BO02"],
      "staticByRule": ["FS01", "FS02"],
      "authorityEffect": "All thirty-two source expressions remain canonical approved Phase A visual inputs. Round 02 application feedback is preserved as evidence but does not create separate Round 04 candidates or alter Phase A approval."
    },
    "functionalSpecimens": {
      "round02Count": 48,
      "round03Count": 47,
      "count": 46,
      "groups": [
        {"prefix": "B-DS", "count": 8},
        {"prefix": "B-FT", "count": 8},
        {"prefix": "B-PR", "count": 10},
        {"prefix": "B-CK", "count": 8},
        {"prefix": "B-BU", "count": 8},
        {"prefix": "B-MB", "count": 4}
      ],
      "survivorIds": ["B-DS01", "B-DS02", "B-DS03", "B-DS04", "B-DS05", "B-DS06", "B-DS07", "B-DS08", "B-FT01", "B-FT02", "B-FT03", "B-FT05", "B-FT07", "B-FT08", "B-FT09", "B-FT10", "B-PR01", "B-PR02", "B-PR03", "B-PR04", "B-PR05", "B-PR06", "B-PR07", "B-PR08", "B-PR09", "B-PR10", "B-CK01", "B-CK02", "B-CK03", "B-CK04", "B-CK05", "B-CK06", "B-CK07", "B-CK08", "B-BU01", "B-BU02", "B-BU03", "B-BU04", "B-BU05", "B-BU06", "B-BU07", "B-BU08", "B-MB01", "B-MB02", "B-MB03", "B-MB04"],
      "killedIds": ["B-FT04", "B-FT06"],
      "round03VerdictCounts": {"keep": 11, "revise": 35, "kill": 1},
      "round03KeepIds": ["B-DS02", "B-DS03", "B-DS04", "B-CK01", "B-CK02", "B-CK05", "B-CK06", "B-BU02", "B-BU03", "B-BU04", "B-BU05"],
      "round03ReviseIds": ["B-DS01", "B-DS05", "B-DS06", "B-DS07", "B-DS08", "B-FT01", "B-FT02", "B-FT03", "B-FT05", "B-FT07", "B-FT08", "B-FT09", "B-FT10", "B-PR01", "B-PR02", "B-PR03", "B-PR04", "B-PR05", "B-PR06", "B-PR07", "B-PR08", "B-PR09", "B-PR10", "B-CK03", "B-CK04", "B-CK07", "B-CK08", "B-BU01", "B-BU06", "B-BU07", "B-BU08", "B-MB01", "B-MB02", "B-MB03", "B-MB04"],
      "round04Treatment": "Carry every Round 03 keep forward, rebuild every Round 03 revise from its named feedback, remove B-FT06, retain the earlier B-FT04 kill, and introduce no replacement specimens.",
      "lineageModule": "brand-kit/workbench/expressions/product-card/phase-b/phase-a-lineage.js",
      "lineageRule": "Every surviving functional specimen preserves every approved Phase A reference recorded in the verbatim Round 02 and Round 03 receipts."
    },
    "requiredWorkbenchModules": ["phase-a-lineage.js"]
  },
  "layers": [
    {
      "id": "PB-L1",
      "name": "Foundations and primitives",
      "authority": "inherited-canonical",
      "purpose": "Layout, controls, fields, feedback, focus, density and responsive behavior from the canonical foundation release."
    },
    {
      "id": "PB-L2",
      "name": "Product-expression adapters",
      "authority": "inherited-canonical",
      "purpose": "Round 10 identity, material, Wings, plate, card, bundle and motion grammar adapted to a functional job."
    },
    {
      "id": "PB-L3",
      "name": "Reusable components",
      "authority": "phase-b-candidate",
      "purpose": "Stable semantic components with slots, state applicability, container behavior, accessibility and consumer events."
    },
    {
      "id": "PB-L4",
      "name": "Website composition patterns",
      "authority": "phase-b-candidate",
      "purpose": "Heroes, menus, featured sections, explainers, bento, pricing, checkout, bundles and footers composed from reusable components."
    },
    {
      "id": "PB-L5",
      "name": "Journey fixtures",
      "authority": "phase-b-candidate",
      "purpose": "Complete buyer and availability journeys that prove components work together without declaring a golden homepage."
    }
  ],
  "semanticModels": [
    {"name": "Product", "authority": "canonical-registry", "purpose": "Stable product identity, public name, extended name, summary, availability and gradient assignment."},
    {"name": "Availability", "authority": "registry-and-consumer", "purpose": "Truthful live, coming-soon, waitlist, unavailable and sold-out behavior."},
    {"name": "Offer", "authority": "fixture-or-consumer", "purpose": "One-time, subscription, usage, bundle, enterprise, trial, waitlist, free and add-on offers without inventing production pricing."},
    {"name": "Price", "authority": "fixture-or-consumer", "purpose": "Amount, currency, cadence, tax status, discount and disclosure supplied by the consumer."},
    {"name": "Plan", "authority": "fixture-or-consumer", "purpose": "Tier, included capabilities, limits, recommendation and billing options for SaaS scenarios."},
    {"name": "Bundle", "authority": "fixture-or-consumer", "purpose": "Included, optional and unavailable products plus bundle savings and selection rules."},
    {"name": "LineItem", "authority": "fixture-or-consumer", "purpose": "Product, bundle, add-on, discount, tax, credit and total rows."},
    {"name": "ProofRecord", "authority": "evidence-or-fixture", "purpose": "Claim, input, mechanism, changed state, result, verification, limitation and evidence class."},
    {"name": "Action", "authority": "component-contract", "purpose": "Semantic label, intent, hierarchy, destination or callback and disabled reason."},
    {"name": "Media", "authority": "canonical-or-consumer", "purpose": "Static material, one focal live core, screenshot, proof artifact or absent media."},
    {"name": "Checkout", "authority": "consumer", "purpose": "Checkout state and provider slots without network calls, Stripe ownership or payment logic inside the component."},
    {"name": "CommerceState", "authority": "component-contract", "purpose": "Empty, partial, ready, processing, confirmed, failed, cancelled and refunded lifecycle."},
    {"name": "MotionAllocation", "authority": "canonical-motion-rule", "purpose": "One automatically live Deep Mineral focal plate with exact static twins everywhere else."}
  ],
  "internalPrimitives": [
    "ProductIdentity",
    "ProductMaterial",
    "ProductCopyStack",
    "AvailabilityStatus",
    "PriceBlock",
    "FeatureList",
    "ProductAction",
    "SelectionControl",
    "OrderSummary",
    "StickyActionBar",
    "ProofRecordRenderer"
  ],
  "components": [
    {
      "id": "PC2-B-C01",
      "name": "ProductDiscoveryCard",
      "shelf": "discovery",
      "role": "Introduce, compare or select one product without forcing a purchase decision.",
      "anatomy": ["product identity", "material or proof slot", "job sentence", "availability", "action"],
      "variants": ["compact", "standard", "portrait", "horizontal", "featured", "selected", "coming-soon"],
      "stateDimensions": ["interaction", "choice", "availability", "async"],
      "receivers": ["compact", "medium", "expanded", "wide"],
      "dataModels": ["Product", "Availability", "Media", "Action"],
      "events": ["onNavigate", "onSelect", "onWaitlist"],